OD id,OD definition,OED id,First attested
pulse_1_noun_2,"A single vibration or short burst of sound, electric current, light, or other wave.",pulse_n2.4d,1904
push_1_verb_6,Develop (a film) so as to compensate for deliberate underexposure.,push_v9f,1954
rally_1_noun_2,"A long-distance race for motor vehicles over public roads or rough terrain, typically in several stages.",rally_n3,1911
range_2_verb_5,"Obtain the range of a target by adjustment after firing past it or short of it, or by the use of radar or laser equipment.",range_v1.5c,1892
ray_2_noun_1,"A broad flat marine or freshwater fish with a cartilaginous skeleton, winglike pectoral fins, and a long slender tail. Many rays have venomous spines or electric organs.",ray_n3,1350
read_1_verb_6,"(of a computer) copy, transfer, or interpret (data)",read_v11e,1940
read_1_verb_8,Hear and understand the words of (someone speaking on a radio transmitter),read_v13a,1930
receive_1_verb_5,Detect or pick up (broadcast signals),receive_v14h,1908
reception_1_noun_3,The process of receiving broadcast signals.,reception_n4c,1843
record_1_verb_2,Convert (sound or a performance) into a permanent form for subsequent reproduction or broadcast.,record_v1.11a,1888
register_1_noun_5,"(in electronic devices) a location in a store of data, used for a specific purpose and with quick access time.",register_n11c,1946
release_1_noun_2,"The action of making a film, recording, or other product available to the public.",release_n3b,1904
rent_1_verb_1,"Pay someone for the use of (something, typically property, land, or a car)",rent_v2.2,1447
resident_1_adjective_2,"(of a computer program, file, etc.) immediately available in computer memory, rather than having to be loaded from elsewhere.",resident_adj5,1963
resistance_1_noun_4,"The degree to which a substance or device opposes the passage of an electric current, causing energy dissipation. By Ohm's law resistance (measured in ohms) is equal to the voltage divided by the current.",resistance_n4a,1746
reveal_1_noun_1,(in a film or television programme) a final revelation of information that has previously been kept from the characters or viewers.,reveal_n1.2,1952
review_1_noun_2,"A critical appraisal of a book, play, film, etc. published in a newspaper or magazine.",review_n7a,1649
review_1_verb_2,"Write a critical appraisal of (a book, play, film, etc.) for publication in a newspaper or magazine.",review_v6a,1705
ride_1_noun_1,"A journey made on a horse, bicycle, or motorcycle, or in a vehicle.",ride_n2.2b,1718
ring_1_verb_3,"Fraudulently change the identity of (a motor vehicle), typically by changing its registration plate.",ring_v1.18c,1962
root_1_verb_4,Gain access to the root account of (a smartphone or computer),root_v1.9,2009
run_1_noun_2,"A journey accomplished or route taken by a vehicle, aircraft, or boat, especially on a regular basis.",run_n2.16a,1712
rush_1_noun_3,The first prints made of a film after a period of shooting.,rush_n2.15,1920
save_1_noun_1,(in soccer and hockey) an act of preventing an opponent's scoring.,save_n2.2a,1883
scale_2_noun_1,"An instrument for weighing, originally a simple balance (a pair of scales) but now usually a device with an electronic or other internal weighing mechanism.",scale_n1.3a,1480
scene_1_noun_2,"A sequence of continuous action in a play, film, opera, or book.",scene_n2ab,1668
screen_1_noun_2,"A flat panel or area on an electronic device such as a television, computer, or smartphone, on which images and data are displayed.",screen_n1.27a,1925
screen_1_noun_3,A transparent finely ruled plate or film used in half-tone reproduction.,screen_n1.21,1852
screen_1_verb_2,Show (a film or video) or broadcast (a television programme),screen_v15a,1912
season_1_noun_2,A set or sequence of related television programmes; a series.,season_n_2007b,1942
secondary_1_noun_2,A secondary coil or winding in an electrical transformer.,secondary_n9,1837
series_1_noun_2,A set or sequence of related television or radio programmes.,series_n9d,1923
series_1_noun_4,Denoting electrical circuits or components arranged so that the current passes through each successively.,series_n13,1831
set_2_noun_3,A radio or television receiver.,set_n2.5c,1891
set_2_noun_4,"A collection of scenery, stage furniture, and other articles used for a particular scene in a play or film.",set_n2.5a,1561
ship_1_noun_2,A spaceship.,ship_n1.4b,1679
ship_1_noun_3,An aircraft.,ship_n1.4b,1679
shock_1_verb_2,"Affect with physiological shock, or with an electric shock.",shock_v3.7,1748
shoot_1_noun_3,An occasion when a professional photographer takes photographs or when a film or video is being made.,shoot_v22d,1890
shoot_1_verb_3,"(in soccer, hockey, basketball, etc.) kick, hit, or throw the ball or puck in an attempt to score a goal.",shoot_v27a,1882
shoot_1_verb_4,"Film or photograph (a scene, film, etc.)",shoot_v22d,1890
shop_1_verb_3,Alter (a photographic image) digitally using Photoshop image-editing software.,shop_v2,1997
short_1_noun_2,A short film as opposed to a feature film.,short_n2l,1929
side_1_noun_6,A television channel considered as one of two or more that are available.,side_n1.36,1961
signal_1_noun_2,An electrical impulse or radio wave transmitted or received.,signal_n1.6,1838
skin_1_noun_5,(especially in jazz) a drum or drum head.,skin_n5b,1926
skirt_1_noun_3,A surface that conceals or protects the wheels or underside of a vehicle or aircraft.,skirt_n4e,1912
slow_1_adjective_5,(of a film) needing long exposure.,slow_adj13b,1867
snow_1_noun_2,"A mass of flickering white spots on a television or radar screen, caused by interference or a poor signal.",snow_n1.5f,1946
sound_1_noun_3,"Music, speech, and sound effects when recorded and used to accompany a film, video, or broadcast.",sound_n3.1c,1928
sour_1_adjective_4,(of petroleum or natural gas) containing a relatively high proportion of sulphur.,sour_adj4,1919
special_1_noun_1,"A thing, such as a product or broadcast, that is designed or organized for a particular occasion or purpose.",special_n1a,1300
standard_1_noun_3,(especially with reference to jazz or blues) a tune or song of established popularity.,standard_n22b,1895
star_1_verb_1,"(of a film, play, or other show) have (someone) as a principal performer.","star_v6a, star_v6e","1815, 1922"
station_1_noun_3,A company involved in broadcasting of a specified kind.,station_n5h,1910
still_1_noun_2,"An ordinary static photograph as opposed to a motion picture, especially a single shot from a cinema film.",still_n2.6a,1916
stream_1_verb_2,"Transmit or receive (data, especially video and audio material) over the Internet as a steady, continuous flow.",stream_v_2013,1981
strip_2_noun_3,A programme broadcast regularly at the same time.,strip_n2_1993c,1969
studio_1_noun_2,A film or television production company.,"studio_n2c, studio_n2e","1909, 1922"
suicide_1_noun_2,"A running drill consisting of a sprint to a set point (especially a line on a basketball court) and back to the start, immediately followed by additional sprints of lengthening distances.",suicide_n1.3,1965
support_1_verb_4,"(of a computer or operating system) allow the use or operation of (a program, language, or device)",support_v8d,1966
sustain_1_noun_1,An effect or facility on a keyboard or electronic instrument whereby a note can be sustained after the key is released.,sustain_n2,1951
swing_1_noun_4,A style of jazz or dance music with a flowing but vigorous rhythm.,swing_n2.10b,1899
tape_1_noun_2,"Long, narrow flexible material with magnetic properties, used for recording sound, pictures, or computer data.",tape_n1.2c,1932
tape_1_verb_1,Record (sound or pictures) on audio or video tape.,tape_v6,1950
thrust_1_noun_2,The propulsive force of a jet or rocket engine.,thrust_n3a,1708
time_1_verb_3,(of a computer or a program) cancel an operation automatically because a predefined interval of time has passed without a certain event happening.,time_v3,1950
trail_1_noun_4,A trailer for a film or broadcast.,trail_n1.11,1973
trail_1_verb_5,"Give advance publicity to (a film, broadcast, or proposal)",train_v1.4,1941
trap_1_noun_8,(among jazz musicians) drums or percussion instruments.,trap_n7,1903
trim_1_noun_4,The degree to which an aircraft can be maintained at a constant altitude without any control forces being present.,trim_n3,1913
trip_1_verb_3,"Activate (a mechanism), especially by contact with a switch, catch, or other electrical device.",trip_v14a,1897
tube_1_noun_4,"A sealed container, typically of glass and either evacuated or filled with gas, containing two electrodes between which an electric current can be made to flow.",tube_n2g,1859
tune_1_verb_2,Adjust (a receiver circuit such as a radio or television) to the frequency of the required signal.,tune_v1c,1887
turkey_1_noun_2,"Something that is extremely or completely unsuccessful, especially a play or film.",turkey_n2.6a,1927
type_1_verb_1,Write (something) on a typewriter or computer by pressing the keys.,type_v4a,1888
up_1_adjective_4,(of a computer system) functioning properly.,up_adv2.13b,1549
van_1_noun_1,"A medium-sized motor vehicle, typically without side windows in the rear part, for transporting goods.",van_n3.1b,1970
vehicle_1_noun_1,"A thing used for transporting people or goods, especially on land, such as a car, lorry, or cart.",vehicle_n3b,1615
vehicle_1_noun_3,"A film, television programme, song, etc. that is intended to display the leading performer to the best advantage.",vehicle_n5,1785
wake_2_noun_1,A trail of disturbed water or air left by the passage of a ship or aircraft.,wake_n2.2a,1753
wash_1_noun_2,The water or air disturbed by a moving boat or aircraft.,wash_n6ba,1883
watch_1_noun_3,A film or programme considered in terms of its appeal to the public.,?,?
western_1_noun_1,"A film, television drama, or novel about cowboys in western North America, set especially in the late 19th and early 20th centuries.",western_n2.4,1910
wheel_1_noun_3,A car.,wheel_n7c,1959
wheel_1_verb_2,(of a bird or aircraft) fly in a wide circle or curve.,wheel_v4c,1805
whip_1_noun_3,"A dessert consisting of cream or eggs beaten into a light fluffy mass with fruit, chocolate, or other ingredients.",whip_n8,1756
whip_1_noun_8,A car.,?,?
wing_1_noun_2,A rigid horizontal structure that projects from both sides of an aircraft and supports it in the air.,wing_n5d,1740
wing_1_noun_3,A raised part of the body of a car or other vehicle above the wheel.,wing_n6e,1783
wing_1_noun_7,"(in soccer, rugby, and hockey) the part of the field close to the sidelines.",wing_n7b,1882
wing_1_verb_1,Travel on wings or by aircraft; fly.,wing_v2a,1616
wipe_1_verb_3,Pass (a swipe card) over an electronic reader.,wipe_v_1997,1985
wire_1_noun_2,An electronic listening device that can be concealed on a person.,wire_n1.9c,1973
wire_1_verb_1,Install electric circuits or wires in.,wire_v9a,1890
average_1_noun_1,A number expressing the central or typical value in a set of data,average_n2.6a,1755
burn_1_noun_4,A cigarette.,burn_n3.1e,1941
card_1_noun_2,A small rectangular piece of plastic containing personal data in a machine-readable form and used to obtain cash or credit or to pay for a telephone call,card_n2.17b,1837
crawl_1_verb_4,(of a program) systematically visit (a number of web pages) in order to create an index of data.,crawl_v1_2009b,1993
drag_1_noun_3,An act of inhaling smoke from a cigarette.,drag_n6f,1914
draw_1_noun_4,An act of drawing on a cigarette or cigar.,draw_n14a,1823
flag_1_noun_3,A variable used to indicate a particular property of the data in a record.,flag_n4.1h,1959
joint_1_noun_4,A cannabis cigarette.,joint_n1.14c,1935
mode_1_noun_3,The value that occurs most frequently in a given set of data.,mode_n13a,1895
noisy_1_adjective_2,Accompanied by or introducing random fluctuations that obscure the real signal or data.,noisy_adj_2b,1944
save_1_noun_2,An act of saving data to a storage location.,save_n2.4,1982
save_1_verb_3,Keep (data) by moving a copy to a storage location.,save_v16a,1961
skin_1_verb_5,Make a cannabis cigarette.,skin_v14,1985
sort_1_noun_2,The arrangement of data in a prescribed sequence.,sort_n4,1956
stream_1_noun_3,A continuous flow of data or instructions,stream_n_1993,1948
write_1_verb_4,Enter (data) into a specified storage medium or location in store.,write_v13,1946